{
  "$schema": "http://json-schema.org/draft-07/schema#",
  "$id": "roadmap.schema.json",
  "title": "Roadkit roadmap",
  "description": "One roadmap rendered by the Roadkit UI. Semantic rules (unique ids, anchors, phase order) are enforced by `python3 tools/roadkit.py check`.",
  "type": "object",
  "required": ["id", "meta", "nodes"],
  "additionalProperties": false,
  "properties": {
    "$schema": { "type": "string" },
    "schemaVersion": { "const": 1 },
    "id": { "type": "string", "pattern": "^[a-z0-9]+(-[a-z0-9]+)*$", "description": "Unique slug; also the key for saved progress. Never change it after use." },
    "meta": {
      "type": "object",
      "required": ["title"],
      "additionalProperties": false,
      "properties": {
        "title": { "type": "string" },
        "eyebrow": { "type": "string", "description": "Small uppercase line above the title." },
        "subtitle": { "type": "string", "description": "Line under the title." },
        "description": { "type": "string", "description": "One sentence; shown in listings." },
        "icon": { "type": "string", "description": "An emoji." },
        "language": { "type": "string", "description": "UI language pack in src/labels/ (pt-BR, en). Default pt-BR." },
        "brand": {
          "type": "object",
          "additionalProperties": false,
          "properties": { "plain": { "type": "string" }, "accent": { "type": "string" } },
          "description": "Sidebar logo: plain text + accent-colored suffix."
        },
        "tagline": { "type": "string", "description": "Sidebar text under the logo. \\n = line break." },
        "sidebarNote": { "type": "string", "description": "Sidebar bottom note. \\n = line break." },
        "footer": { "type": "string" },
        "defaultView": { "enum": ["map", "kanban"], "description": "View opened first. Default map." }
      }
    },
    "theme": {
      "type": "object",
      "additionalProperties": false,
      "properties": {
        "accent": { "type": "string", "pattern": "^#([0-9a-fA-F]{3}|[0-9a-fA-F]{6})$" },
        "brandAccent": { "type": "string", "pattern": "^#([0-9a-fA-F]{3}|[0-9a-fA-F]{6})$" }
      }
    },
    "labels": {
      "type": "object",
      "description": "Overrides for UI strings. Keys are listed in src/labels/pt-BR.json.",
      "additionalProperties": { "type": "string" }
    },
    "phases": {
      "type": "array",
      "description": "Optional. Ordered stages of the roadmap. Omit for a flat list.",
      "items": {
        "type": "object",
        "required": ["id", "title"],
        "additionalProperties": false,
        "properties": {
          "id": { "type": "string", "pattern": "^[a-z0-9]+(-[a-z0-9]+)*$" },
          "title": { "type": "string" },
          "summary": { "type": "string" },
          "period": { "type": "string", "description": "e.g. 'Weeks 1 to 3'." },
          "color": { "type": "string", "pattern": "^#([0-9a-fA-F]{3}|[0-9a-fA-F]{6})$" },
          "milestone": { "type": "string", "description": "Checkpoint shown after the phase's last core node; turns green when the phase is complete." }
        }
      }
    },
    "nodes": {
      "type": "array",
      "minItems": 1,
      "description": "Main topics (no parent, not optional) form the vertical path, in order, grouped by phase. Sub-topics and optional topics hang from a parent and branch to the right, up to 2 levels deep.",
      "items": {
        "type": "object",
        "required": ["id", "title"],
        "additionalProperties": false,
        "properties": {
          "id": { "type": "string", "pattern": "^[a-z0-9]+(-[a-z0-9]+)*$" },
          "title": { "type": "string", "maxLength": 60 },
          "phase": { "type": "string", "description": "Phase id. Required on main topics when the roadmap defines phases; sub-topics inherit their parent's." },
          "time": { "type": "string", "description": "Free text, e.g. 'Week 2'." },
          "summary": { "type": "string" },
          "topics": { "type": "array", "items": { "type": "string" } },
          "challenge": { "type": "string", "description": "Hands-on task / deliverable." },
          "success": { "type": "string", "description": "How to know it is done." },
          "links": {
            "type": "array",
            "items": {
              "type": "object",
              "required": ["title", "url"],
              "additionalProperties": false,
              "properties": { "title": { "type": "string" }, "url": { "type": "string", "pattern": "^https?://" } }
            }
          },
          "status": { "enum": ["todo", "working", "review", "finished"], "description": "Initial column in the kanban. Default: derived from the tasks, or todo." },
          "tasks": {
            "type": "array",
            "description": "Optional checklist shown as a small kanban inside the card. Finishing the topic finishes every task.",
            "items": {
              "type": "object",
              "required": ["id", "title"],
              "additionalProperties": false,
              "properties": {
                "id": { "type": "string", "pattern": "^[a-z0-9]+(-[a-z0-9]+)*$" },
                "title": { "type": "string" },
                "note": { "type": "string" },
                "status": { "enum": ["todo", "working", "review", "finished"] }
              }
            }
          },
          "parent": { "type": "string", "description": "Id of the topic this one is a sub-topic of (up to 2 levels below a main topic). A topic with required sub-topics is finished when they all are." },
          "optional": { "type": "boolean", "description": "Side branch; does not count toward progress or toward its parent. Needs a parent." },
          "anchor": { "type": "string", "description": "Older name for `parent`, used by optional nodes. Prefer `parent`." }
        }
      }
    }
  }
}
